Title,Year,Scopus Source title,Citations,DOI,Journal title,OA model
Cortisol plays a role in the high environmental ammonia associated suppression of the immune response in zebrafish,2017,General and Comparative Endocrinology,4,10.1016/j.ygcen.2017.02.016,General and Comparative Endocrinology,Hybrid
A parametric study of the nonlinear dynamics and sensitivity of a beam-rigid body microgyroscope,2017,Communications in Nonlinear Science and Numerical Simulation,4,10.1016/j.cnsns.2017.02.016,Communications in Nonlinear Science and Numerical Simulation,Hybrid
A system for selectively encapsulating porogens inside the layers during additive manufacturing: From conceptual design to the first prototype,2017,Journal of Manufacturing Processes,4,10.1016/j.jmapro.2017.03.001,Journal of Manufacturing Processes,Hybrid
Separation of Janus droplets and oil droplets in microchannels by wall-induced dielectrophoresis,2017,Journal of Chromatography A,4,10.1016/j.chroma.2017.04.027,Journal of Chromatography A,Hybrid
Passivity analysis of neural networks with two different Markovian jumping parameters and mixed time delays,2017,ISA Transactions,4,10.1016/j.isatra.2017.04.001,ISA Transactions,Hybrid
Inter-laboratory validation of a thin film microextraction technique for determination of pesticides in surface water samples,2017,Analytica Chimica Acta,4,10.1016/j.aca.2017.02.014,Analytica Chimica Acta,Hybrid
Morphology and mechanical properties of poly(?-hydroxybutyrate)/poly(?-caprolactone) blends controlled with cellulosic particles,2017,Carbohydrate Polymers,4,10.1016/j.carbpol.2017.06.053,Carbohydrate Polymers,Hybrid
Soot aggregate sizing through multiangle elastic light scattering: Influence of model error,2017,Journal of Aerosol Science,4,10.1016/j.jaerosci.2017.06.003,Journal of Aerosol Science,Hybrid
Strategic inventories with quality deterioration,2017,European Journal of Operational Research,4,10.1016/j.ejor.2016.08.062,European Journal of Operational Research,Hybrid
On the dual risk model with Parisian implementation delays in dividend payments,2017,European Journal of Operational Research,4,10.1016/j.ejor.2016.09.018,European Journal of Operational Research,Hybrid
A mechanical–thermal noise analysis of a nonlinear microgyroscope,2017,Mechanical Systems and Signal Processing,4,10.1016/j.ymssp.2016.06.005,Mechanical Systems and Signal Processing,Hybrid
On the arithmetic complexity of Strassen-like matrix multiplications,2017,Journal of Symbolic Computation,4,10.1016/j.jsc.2016.07.004,Journal of Symbolic Computation,Hybrid
An autonomous and efficient controller-based routing scheme for networking Named-Data mobility,2017,Computer Communications,4,10.1016/j.comcom.2017.02.001,Computer Communications,Hybrid
Enabling electricity access in developing countries: A probabilistic weather driven house based approach,2017,Applied Energy,4,10.1016/j.apenergy.2017.01.075,Applied Energy,Hybrid
Analysis of laterally loaded short and long piles in multilayered heterogeneous elastic soil,2017,Soils and Foundations,4,10.1016/j.sandf.2017.01.007,Soils and Foundations,Open Access
"Hydrology of a wetland-dominated headwater basin in the Boreal Plain, Alberta, Canada",2017,Journal of Hydrology,4,10.1016/j.jhydrol.2017.01.052,Journal of Hydrology,Hybrid
Disambiguating context-dependent polarity of words: An information retrieval approach,2017,Information Processing and Management,4,10.1016/j.ipm.2017.03.007,Information Processing and Management,Hybrid
Linear programming and windowing based feedrate optimization for spline toolpaths,2017,CIRP Annals - Manufacturing Technology,4,10.1016/j.cirp.2017.04.058,CIRP Annals - Manufacturing Technology,Hybrid
Enhanced DNA sensitized Tb3+luminescence in organic solvents for more sensitive detection,2017,Analytica Chimica Acta,4,10.1016/j.aca.2017.04.046,Analytica Chimica Acta,Hybrid
Comparing three models to estimate transpiration of desert shrubs,2017,Journal of Hydrology,4,10.1016/j.jhydrol.2017.05.027,Journal of Hydrology,Hybrid
"Applying GIS and statistical analysis to assess the correlation of human behaviour and ephemeral architectural features among Palaeo-Eskimo sites on Southern Baffin Island, Nunavut",2017,Journal of Archaeological Science: Reports,4,10.1016/j.jasrep.2017.05.004,Journal of Archaeological Science: Reports,Hybrid
Carbon nanomaterial-enhanced scaffolds for the creation of cardiac tissue constructs: A new frontier in cardiac tissue engineering,2017,Carbon,4,10.1016/j.carbon.2017.05.050,Carbon,Hybrid
Degradation of proteoglycan 4/lubricin by cathepsin S: Potential mechanism for diminished ocular surface lubrication in Sjögren's syndrome,2017,Experimental Eye Research,4,10.1016/j.exer.2017.05.006,Experimental Eye Research,Hybrid
Bending of rectangular orthotropic thin plates with rotationally restrained edges: A finite integral transform solution,2017,Applied Mathematical Modelling,4,10.1016/j.apm.2017.01.053,Applied Mathematical Modelling,Hybrid
Agroecology and healthy food systems in semi-humid tropical Africa: Participatory research with vulnerable farming households in Malawi,2017,Acta Tropica,4,10.1016/j.actatropica.2016.10.022,Acta Tropica,Hybrid
On modeling beam-rigid-body microgyroscopes,2017,Applied Mathematical Modelling,4,10.1016/j.apm.2016.10.001,Applied Mathematical Modelling,Hybrid
Mathematical modelling of plasticity and phenotype switching in cancer cell populations,2017,Mathematical Biosciences,4,10.1016/j.mbs.2016.11.008,Mathematical Biosciences,Hybrid
Effect of thermal annealing on properties of polycrystalline ZnO thin films,2017,Journal of Crystal Growth,4,10.1016/j.jcrysgro.2016.07.026,Journal of Crystal Growth,Hybrid
Fluorescence spectroscopy and principal component analysis of soy protein hydrolysate fractions and the potential to assess their antioxidant capacity characteristics,2017,Food Chemistry,4,10.1016/j.foodchem.2016.08.029,Food Chemistry,Hybrid
Experimental study of flow through a cluster of three equally spaced cylinders,2017,Experimental Thermal and Fluid Science,4,10.1016/j.expthermflusci.2016.08.016,Experimental Thermal and Fluid Science,Hybrid
Elastic-plastic property evaluation using a nearly flat instrumented indenter,2017,International Journal of Solids and Structures,4,10.1016/j.ijsolstr.2016.09.036,International Journal of Solids and Structures,Hybrid
Pairwise registration of TLS point clouds using covariance descriptors and a non-cooperative game,2017,ISPRS Journal of Photogrammetry and Remote Sensing,4,10.1016/j.isprsjprs.2017.10.001,ISPRS Journal of Photogrammetry and Remote Sensing,Hybrid
Pore network modeling of reaction-diffusion in hierarchical porous particles: The effects of microstructure,2017,Chemical Engineering Journal,4,10.1016/j.cej.2017.07.139,Chemical Engineering Journal,Hybrid
Sparse supervised principal component analysis (SSPCA) for dimension reduction and variable selection,2017,Engineering Applications of Artificial Intelligence,4,10.1016/j.engappai.2017.07.004,Engineering Applications of Artificial Intelligence,Hybrid
Comprehensive study on hybrid anaerobic reactor built-in with sleeve type bioelectrocatalyzed modules,2017,Chemical Engineering Journal,4,10.1016/j.cej.2017.07.167,Chemical Engineering Journal,Hybrid
Twin primes and the parity problem,2017,Journal of Number Theory,4,10.1016/j.jnt.2017.05.011,Journal of Number Theory,Hybrid
Synchrotron X-ray nano computed tomography based simulation of stress evolution in LiMn2O4electrodes,2017,Electrochimica Acta,4,10.1016/j.electacta.2017.07.089,Electrochimica Acta,Hybrid
Does sorption influence isotope ratios of chlorinated hydrocarbons under field conditions?,2017,Applied Geochemistry,4,10.1016/j.apgeochem.2017.07.016,Applied Geochemistry,Hybrid
Acidogenic digestion of food waste in a thermophilic leach bed reactor: Effect of pH and leachate recirculation rate on hydrolysis and volatile fatty acid production,2017,Bioresource Technology,4,10.1016/j.biortech.2017.08.130,Bioresource Technology,Hybrid
Power and fuel economy optimizations of gasoline engines using hydraulic variable valve actuation system,2017,Applied Energy,4,10.1016/j.apenergy.2017.08.208,Applied Energy,Hybrid
On the effect of throughout layer thickness variation on properties of additively manufactured cellular titanium structures,2017,Additive Manufacturing,4,10.1016/j.addma.2017.08.017,Additive Manufacturing,Hybrid
Regeneration of cobalt complexes by thermal decomposition and acid treatment for NO absorption,2017,Chemical Engineering Journal,4,10.1016/j.cej.2017.01.027,Chemical Engineering Journal,Hybrid
Post-event processing in social anxiety disorder: Examining the mediating roles of positive metacognitive beliefs and perceptions of performance,2017,Behaviour Research and Therapy,4,10.1016/j.brat.2017.01.002,Behaviour Research and Therapy,Hybrid
Read my lips: Visual speech influences word processing in infants,2017,Cognition,4,10.1016/j.cognition.2017.01.002,Cognition,Hybrid
Statistical analysis of the size- and rate-dependence of yield and plastic flow in nanocrystalline copper pillars,2017,Acta Materialia,4,10.1016/j.actamat.2017.01.033,Acta Materialia,Hybrid
Tuning DNA adsorption affinity and density on metal oxide and phosphate for improved arsenate detection,2017,Journal of Colloid and Interface Science,4,10.1016/j.jcis.2017.01.037,Journal of Colloid And Interface Science,Hybrid
A systematic review of interventions to promote work participation in older workers,2017,Journal of Safety Research,4,10.1016/j.jsr.2016.12.004,Journal of Safety Research,Hybrid
Effects of age on force steadiness: A literature review and meta-analysis,2017,Ageing Research Reviews,4,10.1016/j.arr.2016.11.004,Ageing Research Reviews,Hybrid
Toxicity of oil sands acid-extractable organic fractions to freshwater fish: Pimephales promelas (fathead minnow) and Oryzias latipes (Japanese medaka),2017,Chemosphere,4,10.1016/j.chemosphere.2016.12.059,Chemosphere,Hybrid
An efficient finite-difference strategy for sensitivity analysis of stochastic models of biochemical systems,2017,BioSystems,4,10.1016/j.biosystems.2016.11.006,BioSystems,Hybrid
Probabilistic finite element investigation of prestressing loss in nuclear containment wall segments,2017,Nuclear Engineering and Design,4,10.1016/j.nucengdes.2016.11.018,Nuclear Engineering and Design,Hybrid
Magmato-hydrothermal space: A new metric for geochemical characterisation of metallic ore deposits,2017,Ore Geology Reviews,4,10.1016/j.oregeorev.2016.11.001,Ore Geology Reviews,Hybrid
A constrained extended Kalman filter for the optimal estimate of kinematics and kinetics of a sagittal symmetric exercise,2017,Journal of Biomechanics,4,10.1016/j.jbiomech.2016.12.027,Journal of Biomechanics,Hybrid
Perceived timing of a postural perturbation,2017,Neuroscience Letters,4,10.1016/j.neulet.2016.12.055,Neuroscience Letters,Hybrid
Scavengers for bacteria: Rainbow trout have two functional variants of MARCO that bind to gram-negative and –positive bacteria,2017,Developmental and Comparative Immunology,3,10.1016/j.dci.2017.07.021,Developmental and Comparative Immunology,Hybrid
Concurrent photocatalytic and filtration processes using doped TiO2coated quartz fiber membranes in a photocatalytic membrane reactor,2017,Chemical Engineering Journal,3,10.1016/j.cej.2017.07.141,Chemical Engineering Journal,Hybrid
Resource extraction with a carbon tax and regime switching prices: Exercising your options,2017,Energy Economics,3,10.1016/j.eneco.2017.07.013,Energy Economics,Hybrid
Classification of EEG signals to identify variations in attention during motor task execution,2017,Journal of Neuroscience Methods,3,10.1016/j.jneumeth.2017.04.008,Journal of Neuroscience Methods,Hybrid
Seasonal variability in Northern Hemisphere atmospheric circulation during the Medieval Climate Anomaly and the Little Ice Age,2017,Quaternary Science Reviews,3,10.1016/j.quascirev.2017.04.018,Quaternary Science Reviews,Hybrid
Alternative models for markets with nonconvexities,2017,European Journal of Operational Research,3,10.1016/j.ejor.2017.02.032,European Journal of Operational Research,Hybrid
"Contrasting dual (C, Cl) isotope fractionation offers potential to distinguish reductive chloroethene transformation from breakdown by permanganate",2017,Science of the Total Environment,3,10.1016/j.scitotenv.2017.03.292,Science of the Total Environment,Hybrid
Interocular suppression in children with deprivation amblyopia,2017,Vision Research,3,10.1016/j.visres.2017.01.004,Vision Research,Hybrid
The role of NGOs in negotiating the use of biodiversity in marine areas beyond national jurisdiction,2017,Marine Policy,3,10.1016/j.marpol.2017.03.004,Marine Policy,Hybrid
Hierarchical task network planning with resources and temporal constraints,2017,Knowledge-Based Systems,3,10.1016/j.knosys.2017.06.036,Knowledge-Based Systems,Hybrid
Bacterial mobilization and transport through manure enriched soils: Experiment and modeling,2017,Journal of Environmental Management,3,10.1016/j.jenvman.2017.07.009,Journal of Environmental Management,Hybrid
Exposure and risk characterization for dietary methylmercury from seafood consumption in Kuwait,2017,Science of the Total Environment,3,10.1016/j.scitotenv.2017.07.033,Science of the Total Environment,Hybrid
"Geophysical and atmospheric controls on Ku-, X- and C-band backscatter evolution from a saline snow cover on first-year sea ice from late-winter to pre-early melt",2017,Remote Sensing of Environment,3,10.1016/j.rse.2017.06.029,Remote Sensing of Environment,Hybrid
Heat removal and catalyst deactivation in a Sabatier reactor for chemical fixation of CO2: Simulation-based analysis,2017,Chemical Engineering Journal,3,10.1016/j.cej.2017.06.160,Chemical Engineering Journal,Hybrid
Identifying the critical physical demanding tasks of paramedic work: Towards the development of a physical employment standard,2017,Applied Ergonomics,3,10.1016/j.apergo.2017.06.021,Applied Ergonomics,Hybrid
Quantification of the methane concentration using anaerobic oxidation of methane coupled to extracellular electron transfer,2017,Bioresource Technology,3,10.1016/j.biortech.2017.06.053,Bioresource Technology,Hybrid
An intelligent system for estimating frog community calling activity and species richness,2017,Ecological Indicators,3,10.1016/j.ecolind.2017.06.015,Ecological Indicators,Hybrid
Photoluminescence decay dynamics in ?-Ga2O3nanocrystals: The role of exclusion distance at short time scales,2017,Chemical Physics Letters,3,10.1016/j.cplett.2017.06.052,Chemical Physics Letters,Hybrid
Coarse-resolution numerical prediction of small wind turbine noise with validation against field measurements,2017,Renewable Energy,3,10.1016/j.renene.2016.10.070,Renewable Energy,Hybrid
Multi-Channel Generalized-ICP: A robust framework for multi-channel scan registration,2017,Robotics and Autonomous Systems,3,10.1016/j.robot.2016.10.016,Robotics and Autonomous Systems,Hybrid
A multi-isotope approach towards constraining the origin of large-scale Paleoproterozoic B-(Fe) mineralization in NE China,2017,Precambrian Research,3,10.1016/j.precamres.2017.01.030,Precambrian Research,Hybrid
"Assessing the feasibility of resettlement as a climate change adaptation strategy for informal settlements in Metro Manila, Philippines",2017,International Journal of Disaster Risk Reduction,3,10.1016/j.ijdrr.2017.01.005,International Journal of Disaster Risk Reduction,Hybrid
Human dorsomedial parieto-motor circuit specifies grasp during the planning of goal-directed hand actions,2017,Cortex,3,10.1016/j.cortex.2017.04.007,Cortex,Hybrid
Pyrolysis and spontaneous ignition of wood under transient irradiation: Experiments and a-priori predictions,2017,Fire Safety Journal,3,10.1016/j.firesaf.2017.03.081,Fire Safety Journal,Hybrid
"Fast, deterministic computation of the Hermite normal form and determinant of a polynomial matrix",2017,Journal of Complexity,3,10.1016/j.jco.2017.03.003,Journal of Complexity,Hybrid
"Understanding support and opposition to wind turbine development in Ontario, Canada and assessing possible steps for future development",2017,Renewable Energy,3,10.1016/j.renene.2017.05.005,Renewable Energy,Hybrid
GLNS: An effective large neighborhood search heuristic for the Generalized Traveling Salesman Problem,2017,Computers and Operations Research,3,10.1016/j.cor.2017.05.010,Computers and Operations Research,Hybrid
"Crystal structure, DNA interaction and thermal analysis data of two new antimicrobial active binuclear cadmium and mercury complexes",2017,Journal of Molecular Structure,3,10.1016/j.molstruc.2017.05.073,Journal of Molecular Structure,Hybrid
Young children protest and correct pretense that contradicts their general knowledge,2017,Cognitive Development,3,10.1016/j.cogdev.2017.05.002,Cognitive Development,Hybrid
Decision making in a complex world: Using OPTamos in a multi-criteria process for land management in the Cuitzmala watershed in Mexico,2017,Land Use Policy,3,10.1016/j.landusepol.2017.05.025,Land Use Policy,Hybrid
Synthesis of hierarchical structure cuprous oxide by a novel two-step hydrothermal method and the effect of its addition on the photovoltaic properties of ZnO-based dye-sensitized solar cells,2017,Journal of Alloys and Compounds,3,10.1016/j.jallcom.2017.05.334,Journal of Alloys and Compounds,Hybrid
Highly informative multiclass profiling of lipids by ultra-high performance liquid chromatography – Low resolution (quadrupole) mass spectrometry by using electrospray ionization and atmospheric pressure chemical ionization interfaces,2017,Journal of Chromatography A,3,10.1016/j.chroma.2017.06.017,Journal of Chromatography A,Hybrid
Spectroscopic models for laser-heated silicon and copper nanoparticles,2017,Journal of Quantitative Spectroscopy and Radiative Transfer,3,10.1016/j.jqsrt.2016.10.006,Journal of Quantitative Spectroscopy and Radiative Transfer,Hybrid
Influence of attention alternation on movement-related cortical potentials in healthy individuals and stroke patients,2017,Clinical Neurophysiology,3,10.1016/j.clinph.2016.11.001,Clinical Neurophysiology,Hybrid
"The relief of dry eye signs and symptoms using a combination of lubricants, lid hygiene and ocular nutraceuticals",2017,Journal of Optometry,3,10.1016/j.optom.2016.05.001,Journal of Optometry,Open Access
Organic matter in sediment layers of an acidic mining lake as assessed by lipid analysis. Part II: Neutral lipids,2017,Science of the Total Environment,3,10.1016/j.scitotenv.2016.01.116,Science of the Total Environment,Hybrid
Periodicity in rectangular arrays,2017,Information Processing Letters,3,10.1016/j.ipl.2016.09.011,Information Processing Letters,Hybrid
The ‘Arm Force Field’ method to predict manual arm strength based on only hand location and force direction,2017,Applied Ergonomics,3,10.1016/j.apergo.2016.09.012,Applied Ergonomics,Hybrid
Rasmussen and the boundaries of empirical evaluation,2017,Applied Ergonomics,3,10.1016/j.apergo.2016.10.003,Applied Ergonomics,Hybrid
Using cube models to understand trends in thermal accommodation coefficients at high surface temperatures,2017,International Journal of Heat and Mass Transfer,3,10.1016/j.ijheatmasstransfer.2017.03.090,International Journal of Heat and Mass Transfer,Hybrid
Thermal monitoring of microstructure and carbide morphology in direct metal deposition of Fe-Ti-C metal matrix composites,2017,Journal of Alloys and Compounds,3,10.1016/j.jallcom.2017.03.207,Journal of Alloys and Compounds,Hybrid
The within-strip discrete unit disk cover problem,2017,Theoretical Computer Science,3,10.1016/j.tcs.2017.01.030,Theoretical Computer Science,Hybrid
Pure cycles in two-machine dual-gripper robotic cells,2017,Robotics and Computer-Integrated Manufacturing,3,10.1016/j.rcim.2017.03.004,Robotics and Computer-Integrated Manufacturing,Hybrid
Long-term effects of a Phragmites australis invasion on birds in a Lake Erie coastal marsh,2017,Journal of Great Lakes Research,3,10.1016/j.jglr.2017.03.018,Journal of Great Lakes Research,Hybrid
Photocatalytic performances of ZnO nanoparticle film and vertically aligned nanorods in chamber-based microfluidic reactors: Reaction kinetics and flow effects,2017,Applied Catalysis B: Environmental,3,10.1016/j.apcatb.2017.03.020,Applied Catalysis B: Environmental,Hybrid
Model predictive control of vehicle stability using coordinated active steering and differential brakes,2017,Mechatronics,3,10.1016/j.mechatronics.2017.10.003,Mechatronics,Hybrid
"Comparing non-invasive scapular tracking methods across elevation angles, planes of elevation and humeral axial rotations",2017,Journal of Electromyography and Kinesiology,3,10.1016/j.jelekin.2017.10.001,Journal of Electromyography and Kinesiology,Hybrid
Learning terms and definitions: Drawing and the role of elaborative encoding,2017,Acta Psychologica,3,10.1016/j.actpsy.2017.07.008,Acta Psychologica,Hybrid
"New copper(II) complex with bioactive 2–acetylpyridine-4N-p-chlorophenylthiosemicarbazone ligand: Synthesis, X-ray structure, and evaluation of antioxidant and antibacterial activity",2017,Inorganic Chemistry Communications,3,10.1016/j.inoche.2017.08.005,Inorganic Chemistry Communications,Hybrid
High frequency pulsed gas metal arc welding (GMAW-P): The metal beam process,2017,Manufacturing Letters,3,10.1016/j.mfglet.2017.01.001,Manufacturing Letters,Hybrid
Further remarks on DNA overlap assembly,2017,Information and Computation,3,10.1016/j.ic.2017.01.009,Information and Computation,Hybrid
Lean muscle volume of the thigh has a stronger relationship with muscle power than muscle strength in women with knee osteoarthritis,2017,Clinical Biomechanics,3,10.1016/j.clinbiomech.2016.11.005,Clinical Biomechanics,Hybrid
Using the expected detection delay to assess the performance of different multivariate statistical process monitoring methods for multiplicative and drift faults,2017,ISA Transactions,3,10.1016/j.isatra.2016.11.007,ISA Transactions,Hybrid
"Great Lakes Runoff Inter-comparison Project, phase 2: Lake Ontario (GRIP-O)",2017,Journal of Great Lakes Research,3,10.1016/j.jglr.2016.10.004,Journal of Great Lakes Research,Hybrid
Study on locating transformer internal faults using sweep frequency response analysis,2017,Electric Power Systems Research,3,10.1016/j.epsr.2016.11.016,Electric Power Systems Research,Hybrid
Real time joint resistance monitoring during solder reflow,2017,Journal of Alloys and Compounds,3,10.1016/j.jallcom.2016.11.357,Journal of Alloys and Compounds,Hybrid
"The Associations Between E-Cigarettes and Binge Drinking, Marijuana Use, and Energy Drinks Mixed With Alcohol",2017,Journal of Adolescent Health,3,10.1016/j.jadohealth.2016.10.011,Journal of Adolescent Health,Hybrid
Kinematics chain based dimensional variation analysis of construction assemblies using building information models and 3D point clouds,2017,Automation in Construction,3,10.1016/j.autcon.2016.12.001,Automation in Construction,Hybrid
Experimental analyses and numerical modeling of texture evolution and the development of surface roughness during bending of an extruded aluminum alloy using a multiscale modeling framework,2017,International Journal of Plasticity,3,10.1016/j.ijplas.2017.09.013,International Journal of Plasticity,Hybrid
Identifying poses of safe and productive masons using machine learning,2017,Automation in Construction,3,10.1016/j.autcon.2017.09.022,Automation in Construction,Hybrid
On the influence of jurisdiction on the profitability of residential photovoltaic-storage systems: A multi-national case study,2017,Energy Policy,3,10.1016/j.enpol.2017.07.019,Energy Policy,Hybrid
An effective approach for probabilistic lifetime modelling based on the principle of maximum entropy with fractional moments,2017,Applied Mathematical Modelling,3,10.1016/j.apm.2017.07.036,Applied Mathematical Modelling,Hybrid
Multi-products productions from Malaysian oil palm empty fruit bunch (EFB): Analyzing economic potentials from the optimal biomass supply chain,2017,Journal of Cleaner Production,3,10.1016/j.jclepro.2017.08.088,Journal of Cleaner Production,Hybrid
"Hidden truncation hyperbolic distributions, finite mixtures thereof, and their application for clustering",2017,Journal of Multivariate Analysis,3,10.1016/j.jmva.2017.07.008,Journal of Multivariate Analysis,Hybrid
Directed precipitation of anhydrous magnesite for improved performance of mineral carbonation of CO2,2017,Journal of Environmental Chemical Engineering,2,10.1016/j.jece.2017.06.048,Journal of Environmental Chemical Engineering,Hybrid
Real-time management of the waterflooding process using proxy reservoir modeling and data fusion theory,2017,Computers and Chemical Engineering,2,10.1016/j.compchemeng.2017.06.018,Computers and Chemical Engineering,Hybrid
Robust dynamic optimization in heterogeneous multiscale catalytic flow reactors using polynomial chaos expansion,2017,Journal of Process Control,2,10.1016/j.jprocont.2017.07.002,Journal of Process Control,Hybrid
"A new multi-scale framework to incorporate microstructure evolution in phenomenological plasticity: Theory, explicit finite element formulation, implementation and validation",2017,International Journal of Plasticity,2,10.1016/j.ijplas.2017.08.006,International Journal of Plasticity,Hybrid
A complete greedy algorithm for infinite-horizon sensor scheduling,2017,Automatica,2,10.1016/j.automatica.2017.04.018,Automatica,Hybrid
Performance of a concurrent cognitive task modifies pre- and post-perturbation-evoked cortical activity,2017,Neuroscience,2,10.1016/j.neuroscience.2017.02.014,Neuroscience,Hybrid
Economical staging plan for implementing electric vehicle charging stations,2017,"Sustainable Energy, Grids and Networks",2,10.1016/j.segan.2017.02.001,"Sustainable Energy, Grids and Networks",Hybrid
