Title,Year,Scopus Source title,Citations,DOI,Journal title,OA model
A general hierarchical graph model for conflict resolution with application to greenhouse gas emission disputes between USA and China,2017,European Journal of Operational Research,8,10.1016/j.ejor.2016.08.014,European Journal of Operational Research,Hybrid
Privacy-preserving attribute-keyword based data publish-subscribe service on cloud platforms,2017,Information Sciences,8,10.1016/j.ins.2016.09.020,Information Sciences,Hybrid
Evaluating the performance of tailor-made water-soluble copolymers for enhanced oil recovery polymer flooding applications,2017,Fuel,8,10.1016/j.fuel.2017.04.122,Fuel,Hybrid
"A dynamic optimization framework for integration of design, control and scheduling of multi-product chemical processes under disturbance and uncertainty",2017,Computers and Chemical Engineering,8,10.1016/j.compchemeng.2017.05.007,Computers and Chemical Engineering,Hybrid
"Life cycle assessment of thermal energy production from short-rotation willow biomass in Southern Ontario, Canada",2017,Applied Energy,8,10.1016/j.apenergy.2017.07.051,Applied Energy,Hybrid
Managing risk in modular construction using dimensional and geometric tolerance strategies,2017,Automation in Construction,8,10.1016/j.autcon.2017.03.011,Automation in Construction,Hybrid
"Designing, modeling and performance investigation of bio-inspired flow field based DMFCs",2017,International Journal of Hydrogen Energy,8,10.1016/j.ijhydene.2017.01.007,International Journal of Hydrogen Energy,Hybrid
A longitudinal evaluation of food safety knowledge and attitudes among Ontario high school students following a food handler training program,2017,Food Control,8,10.1016/j.foodcont.2017.01.011,Food Control,Hybrid
On the importance of geological data for three-dimensional steady-state hydraulic tomography analysis at a highly heterogeneous aquifer-aquitard system,2017,Journal of Hydrology,8,10.1016/j.jhydrol.2016.12.004,Journal of Hydrology,Hybrid
"Pyrolysis, kinetics analysis, thermodynamics parameters and reaction mechanism of Typha latifolia to evaluate its bioenergy potential",2017,Bioresource Technology,8,10.1016/j.biortech.2017.08.162,Bioresource Technology,Hybrid
Integrated model predictive control and velocity estimation of electric vehicles,2017,Mechatronics,8,10.1016/j.mechatronics.2017.07.002,Mechatronics,Hybrid
Unified two-stage fatigue methodology based on a probabilistic damage model applied to structural details,2017,Theoretical and Applied Fracture Mechanics,7,10.1016/j.tafmec.2017.09.004,Theoretical and Applied Fracture Mechanics,Hybrid
Using surface regolith geochemistry to map the major crustal blocks of the Australian continent,2017,Gondwana Research,7,10.1016/j.gr.2017.02.011,Gondwana Research,Hybrid
Constitutive characterization of a rare-earth magnesium alloy sheet (ZEK100-O) in shear loading: Studies of anisotropy and rate sensitivity,2017,International Journal of Mechanical Sciences,7,10.1016/j.ijmecsci.2017.04.013,International Journal of Mechanical Sciences,Hybrid
Uranium isotope compositions of mid-Proterozoic black shales: Evidence for an episode of increased ocean oxygenation at 1.36 Ga and evaluation of the effect of post-depositional hydrothermal fluid flow,2017,Precambrian Research,7,10.1016/j.precamres.2017.06.016,Precambrian Research,Hybrid
Prevalence and Determinants of Poor Food Intake of Residents Living in Long-Term Care,2017,Journal of the American Medical Directors Association,7,10.1016/j.jamda.2017.05.003,Journal of the American Medical Directors Association,Hybrid
"Hurricane Ingrid and Tropical Storm Hanna's effects on the salinity of the coastal aquifer, Quintana Roo, Mexico",2017,Journal of Hydrology,7,10.1016/j.jhydrol.2017.02.024,Journal of Hydrology,Hybrid
Model-informed risk assessment for Zika virus outbreaks in the Asia-Pacific regions,2017,Journal of Infection,7,10.1016/j.jinf.2017.01.015,Journal of Infection,Hybrid
An adaptive model predictive controller for a novel battery-powered anti-idling system of service vehicles,2017,Energy,7,10.1016/j.energy.2017.03.119,Energy,Hybrid
Additive manufacturing of 3D structures with non-Newtonian highly viscous fluids: Finite element modeling and experimental validation,2017,Additive Manufacturing,7,10.1016/j.addma.2016.10.008,Additive Manufacturing,Hybrid
Earnings smoothing: Does it exacerbate or constrain stock price crash risk?,2017,Journal of Corporate Finance,7,10.1016/j.jcorpfin.2016.11.004,Journal of Corporate Finance,Hybrid
Failure parameter identification and validation for a dual-phase 780 steel sheet,2017,International Journal of Solids and Structures,7,10.1016/j.ijsolstr.2017.06.018,International Journal of Solids and Structures,Hybrid
Preparation of nanoparticle and nanowire mixed pastes and their low temperature sintering,2017,Journal of Alloys and Compounds,7,10.1016/j.jallcom.2016.08.060,Journal of Alloys and Compounds,Hybrid
"Local rulemaking, enforcement and compliance in state-owned forest commons",2017,Ecological Economics,7,10.1016/j.ecolecon.2016.09.012,Ecological Economics,Hybrid
"Effect of spacer length on the interfacial behavior of N,N?-bis(dimethylalkyl)-?,?-alkanediammonium dibromide gemini surfactants in the absence and presence of ZnO nanoparticles",2017,Journal of Colloid and Interface Science,7,10.1016/j.jcis.2016.09.069,Journal of Colloid And Interface Science,Hybrid
Microlens topography combined with vascular endothelial growth factor induces endothelial differentiation of human mesenchymal stem cells into vasculogenic progenitors,2017,Biomaterials,7,10.1016/j.biomaterials.2017.03.036,Biomaterials,Hybrid
Effects of task demands on the early neural processing of fearful and happy facial expressions,2017,Brain Research,7,10.1016/j.brainres.2017.03.013,Brain Research,Hybrid
Long-term decline in stream total phosphorus concentrations: A pervasive pattern in all watershed types in Ontario,2017,Journal of Great Lakes Research,7,10.1016/j.jglr.2017.07.005,Journal of Great Lakes Research,Hybrid
A novel branch-based power flow algorithm for islanded AC microgrids,2017,Electric Power Systems Research,7,10.1016/j.epsr.2017.01.019,Electric Power Systems Research,Hybrid
Perceptions and Knowledge of Caffeinated Energy Drinks: Results of Focus Groups With Canadian Youth,2017,Journal of Nutrition Education and Behavior,7,10.1016/j.jneb.2016.11.013,Journal of Nutrition Education and Behavior,Hybrid
"Controls on plot-scale evapotranspiration from a constructed fen in the Athabasca Oil Sands Region, Alberta",2017,Ecological Engineering,7,10.1016/j.ecoleng.2016.12.020,Ecological Engineering,Hybrid
Gradient-based multidisciplinary design of wind farms with continuous-variable formulations,2017,Applied Energy,6,10.1016/j.apenergy.2017.04.030,Applied Energy,Hybrid
"Introducing metaknowledge: Software for computational research in information science, network analysis, and science of science",2017,Journal of Informetrics,6,10.1016/j.joi.2016.12.005,Journal of Informetrics,Hybrid
Experimental and numerical investigation of texture evolution and the effects of intragranular backstresses in aluminum alloys subjected to large strain cyclic deformation,2017,International Journal of Plasticity,6,10.1016/j.ijplas.2016.11.003,International Journal of Plasticity,Hybrid
Multiaxial cyclic behaviour and fatigue modelling of AM30 Mg alloy extrusion,2017,International Journal of Fatigue,6,10.1016/j.ijfatigue.2016.12.037,International Journal of Fatigue,Hybrid
Visualising data distributions with kernel density estimation and reduced chi-squared statistic,2017,Geoscience Frontiers,6,10.1016/j.gsf.2017.05.002,Geoscience Frontiers,Open Access
Biocompatible polymer microneedle for topical/dermal delivery of tranexamic acid,2017,Journal of Controlled Release,6,10.1016/j.jconrel.2017.06.016,Journal of Controlled Release,Hybrid
Greenhouse gas emissions reductions from applications of Power-to-Gas in power generation,2017,Sustainable Energy Technologies and Assessments,6,10.1016/j.seta.2017.02.003,Sustainable Energy Technologies and Assessments,Hybrid
Dynamic reduced order modeling of an entrained-flow slagging gasifier using a new recirculation ratio correlation,2017,Fuel,6,10.1016/j.fuel.2017.01.079,Fuel,Hybrid
A KPI-based process monitoring and fault detection framework for large-scale processes,2017,ISA Transactions,6,10.1016/j.isatra.2017.01.029,ISA Transactions,Hybrid
Carbon nanowalls: A new material for resistive switching memory devices,2017,Carbon,6,10.1016/j.carbon.2017.05.004,Carbon,Hybrid
Modeling the formability of aluminum alloys at elevated temperatures using a new thermo-elasto-viscoplastic crystal plasticity framework,2017,International Journal of Mechanical Sciences,6,10.1016/j.ijmecsci.2017.05.005,International Journal of Mechanical Sciences,Hybrid
Effects of rare earth oxide additive on surface and tribological properties of polyimide composites,2017,Applied Surface Science,6,10.1016/j.apsusc.2017.04.172,Applied Surface Science,Hybrid
Stochastic modeling of polymer electrolyte membrane fuel cell gas diffusion layers – Part 2: A comprehensive substrate model with pore size distribution and heterogeneity effects,2017,International Journal of Hydrogen Energy,6,10.1016/j.ijhydene.2017.04.269,International Journal of Hydrogen Energy,Hybrid
Comparison of stochastic fault detection and classification algorithms for nonlinear chemical processes,2017,Computers and Chemical Engineering,6,10.1016/j.compchemeng.2017.05.016,Computers and Chemical Engineering,Hybrid
On RAC drawings of 1-planar graphs,2017,Theoretical Computer Science,6,10.1016/j.tcs.2017.05.039,Theoretical Computer Science,Hybrid
Aquatic macroinvertebrates are poor indicators of agricultural activity in northern prairie pothole wetlands,2017,Ecological Indicators,6,10.1016/j.ecolind.2017.06.013,Ecological Indicators,Hybrid
Evaluation of the cycling performance of a sorbent for H2S removal and simulation of desulfurization-regeneration processes,2017,Chemical Engineering Journal,6,10.1016/j.cej.2017.05.098,Chemical Engineering Journal,Hybrid
Analysis of protein enrichment during single- and multi-stage tribo-electrostatic bioseparation processes for dry fractionation of legume flour,2017,Separation and Purification Technology,6,10.1016/j.seppur.2016.11.050,Separation and Purification Technology,Hybrid
High-resolution global maps of 21st-century annual forest loss: Independent accuracy assessment and application in a temperate forest region of Atlantic Canada,2017,Remote Sensing of Environment,6,10.1016/j.rse.2016.10.040,Remote Sensing of Environment,Hybrid
Monotonic and cyclic behaviour of cast and cast-forged AZ80 Mg,2017,International Journal of Fatigue,6,10.1016/j.ijfatigue.2017.06.038,International Journal of Fatigue,Hybrid
A randomized controlled study of practice facilitation to improve the provision of medication management services in Alberta community pharmacies,2017,Research in Social and Administrative Pharmacy,6,10.1016/j.sapharm.2016.02.013,Research in Social and Administrative Pharmacy,Hybrid
"Supporting the human life-raft in confronting the juggernaut of technology: Jens Rasmussen, 1961–1986",2017,Applied Ergonomics,6,10.1016/j.apergo.2016.01.016,Applied Ergonomics,Hybrid
Residents’ support for red tourism in China: The moderating effect of central government,2017,Annals of Tourism Research,6,10.1016/j.annals.2017.03.001,Annals of Tourism Research,Hybrid
The effect of He+irradiation on hardness and elastic modulus of Fe-Cr–40 wt.% TiB2composite rod designed for neutron absorbing,2017,Journal of Alloys and Compounds,6,10.1016/j.jallcom.2017.03.350,Journal of Alloys and Compounds,Hybrid
Post-fire ecohydrological conditions at peatland margins in different hydrogeological settings of the Boreal Plain,2017,Journal of Hydrology,6,10.1016/j.jhydrol.2017.03.034,Journal of Hydrology,Hybrid
What did you have in mind? Examining the content of intentional and unintentional types of mind wandering,2017,Consciousness and Cognition,6,10.1016/j.concog.2017.03.007,Consciousness and Cognition,Hybrid
Uptake of Community Pharmacist-Delivered MedsCheck Diabetes Medication Review Service in Ontario between 2010 and 2014,2017,Canadian Journal of Diabetes,6,10.1016/j.jcjd.2016.12.001,Canadian Journal of Diabetes,Hybrid
Engineered architecture of nitrogenous graphene encapsulating porous carbon with nano-channel reactors enhancing the PEM fuel cell performance,2017,Nano Energy,6,10.1016/j.nanoen.2017.10.051,Nano Energy,Hybrid
Susceptibility to cigarette smoking among middle and high school e-cigarette users in Canada,2017,Preventive Medicine,6,10.1016/j.ypmed.2017.07.017,Preventive Medicine,Hybrid
Pedestrian level wind assessment through city development: A study of the financial district in Toronto,2017,Sustainable Cities and Society,6,10.1016/j.scs.2017.06.004,Sustainable Cities and Society,Hybrid
"Gini-type measures of risk and variability: Gini shortfall, capital allocations, and heavy-tailed risks",2017,Journal of Banking and Finance,6,10.1016/j.jbankfin.2017.06.013,Journal of Banking and Finance,Hybrid
Direct-methane solid oxide fuel cell (SOFC) with Ni-SDC anode-supported cell,2017,International Journal of Hydrogen Energy,6,10.1016/j.ijhydene.2017.07.117,International Journal of Hydrogen Energy,Hybrid
Pitch angle control for a small-scale Darrieus vertical axis wind turbine with straight blades (H-Type VAWT),2017,Renewable Energy,6,10.1016/j.renene.2017.07.068,Renewable Energy,Hybrid
Fast quantitation of opioid isomers in human plasma by differential mobility spectrometry/mass spectrometry via SPME/open-port probe sampling interface,2017,Analytica Chimica Acta,6,10.1016/j.aca.2017.08.023,Analytica Chimica Acta,Hybrid
Monitoring the evolution and migration of a methane gas plume in an unconfined sandy aquifer using time-lapse GPR and ERT,2017,Journal of Contaminant Hydrology,6,10.1016/j.jconhyd.2017.08.011,Journal of Contaminant Hydrology,Hybrid
Correlation between mechanical dissipation and improved X-band electromagnetic shielding capabilities of amine functionalized graphene/thermoplastic polyurethane composites,2017,European Polymer Journal,6,10.1016/j.eurpolymj.2017.08.038,European Polymer Journal,Hybrid
Identification of critical contaminants in wastewater effluent for managed aquifer recharge,2017,Chemosphere,6,10.1016/j.chemosphere.2016.12.120,Chemosphere,Hybrid
Development of an innovative prestressing CFRP plate anchor: Numerical modelling and parametric study,2017,Composite Structures,6,10.1016/j.compstruct.2016.12.039,Composite Structures,Hybrid
Microbial selenium sulfide reduction for selenium recovery from wastewater,2017,Journal of Hazardous Materials,6,10.1016/j.jhazmat.2016.12.061,Journal of Hazardous Materials,Hybrid
Investigation of ozone and peroxone impacts on natural organic matter character and biofiltration performance using fluorescence spectroscopy,2017,Chemosphere,6,10.1016/j.chemosphere.2016.12.118,Chemosphere,Hybrid
Characterization of the flow in a gas-solid bubbling fluidized bed by pressure fluctuation,2017,Chemical Engineering Science,6,10.1016/j.ces.2017.09.001,Chemical Engineering Science,Hybrid
Fault-tolerant synchronization for nonlinear switching systems with time-varying delay,2017,Nonlinear Analysis: Hybrid Systems,5,10.1016/j.nahs.2016.06.005,Nonlinear Analysis: Hybrid Systems,Hybrid
Environmental Electrokinetics for a sustainable subsurface,2017,Chemosphere,5,10.1016/j.chemosphere.2017.03.143,Chemosphere,Hybrid
Effects of vitamin D and resveratrol on metabolic associated markers in liver and adipose tissue from SAMP8 mice,2017,Experimental Gerontology,5,10.1016/j.exger.2017.03.017,Experimental Gerontology,Hybrid
"Techno-economic, environmental, and safety assessment of hydrogen powered community microgrids; case study in Canada",2017,International Journal of Hydrogen Energy,5,10.1016/j.ijhydene.2017.03.083,International Journal of Hydrogen Energy,Hybrid
Effect of compositions of acceptor polymers on dark current and photocurrent of all-polymer bulk-heterojunction photodetectors,2017,Polymer,5,10.1016/j.polymer.2017.02.060,Polymer,Hybrid
A method for measuring relative in-plane diffusivity of thin and partially saturated porous media: An application to fuel cell gas diffusion layers,2017,International Journal of Heat and Mass Transfer,5,10.1016/j.ijheatmasstransfer.2017.02.096,International Journal of Heat and Mass Transfer,Hybrid
The hydrological functioning of a constructed fen wetland watershed,2017,Science of the Total Environment,5,10.1016/j.scitotenv.2017.06.101,Science of the Total Environment,Hybrid
Strengthening of shear-critical RC beams: Alternatives to externally bonded CFRP sheets,2017,Construction and Building Materials,5,10.1016/j.conbuildmat.2017.06.106,Construction and Building Materials,Hybrid
An improved grey dynamic trend incidence model with application to factors causing smog weather,2017,Expert Systems with Applications,5,10.1016/j.eswa.2017.06.012,Expert Systems With Applications,Hybrid
Global climatology based on the ACE-FTS version 3.5 dataset: Addition of mesospheric levels and carbon-containing species in the UTLS,2017,Journal of Quantitative Spectroscopy and Radiative Transfer,5,10.1016/j.jqsrt.2016.07.003,Journal of Quantitative Spectroscopy and Radiative Transfer,Hybrid
Experimental investigations of tuned liquid damper-structure interactions in resonance considering multiple parameters,2017,Journal of Sound and Vibration,5,10.1016/j.jsv.2016.10.036,Journal of Sound and Vibration,Hybrid
Enhancement of direct methanol fuel cell performance through the inclusion of zirconium phosphate,2017,International Journal of Hydrogen Energy,5,10.1016/j.ijhydene.2017.01.188,International Journal of Hydrogen Energy,Hybrid
Heavily nitrogen-doped acetylene black as a high-performance catalyst for oxygen reduction reaction,2017,Carbon,5,10.1016/j.carbon.2017.02.056,Carbon,Hybrid
"Tobacco use cessation interventions for lesbian, gay, bisexual, transgender and queer youth and young adults: A scoping review",2017,Preventive Medicine Reports,5,10.1016/j.pmedr.2017.02.004,Preventive Medicine Reports,Open Access
Cross-linked Pluronic-g-Polyacrylic acid microgel system for the controlled release of doxorubicin in pharmaceutical formulations,2017,European Journal of Pharmaceutics and Biopharmaceutics,5,10.1016/j.ejpb.2017.01.009,European Journal of Pharmaceutics and Biopharmaceutics,Hybrid
Release of phosphorus from crop residue and cover crops over the non-growing season in a cool temperate region,2017,Agricultural Water Management,5,10.1016/j.agwat.2017.04.015,Agricultural Water Management,Hybrid
Binder-jet powder-bed additive manufacturing (3D printing) of thick graphene-based electrodes,2017,Carbon,5,10.1016/j.carbon.2017.04.028,Carbon,Hybrid
"Hurricanes Ingrid and Manuel (2013) and their impact on the salinity of the Meteoric Water Mass, Quintana Roo, Mexico",2017,Journal of Hydrology,5,10.1016/j.jhydrol.2017.04.022,Journal of Hydrology,Hybrid
Development of a novel prestressing anchor for CFRP plates: Experimental investigations,2017,Composite Structures,5,10.1016/j.compstruct.2017.05.011,Composite Structures,Hybrid
Mindfulness and mind wandering: The protective effects of brief meditation in anxious individuals,2017,Consciousness and Cognition,5,10.1016/j.concog.2017.03.009,Consciousness and Cognition,Hybrid
Seeking control in the midst of uncertainty: Women's experiences of choosing mode of birth after caesarean,2017,Women and Birth,5,10.1016/j.wombi.2016.10.005,Women and Birth,Hybrid
Ask in person: You're less persuasive than you think over email,2017,Journal of Experimental Social Psychology,5,10.1016/j.jesp.2016.10.002,Journal of Experimental Social Psychology,Hybrid
A multitasking continuous time formulation for short-term scheduling of operations in multipurpose plants,2017,Computers and Chemical Engineering,5,10.1016/j.compchemeng.2016.11.012,Computers and Chemical Engineering,Hybrid
The efficacy of assisted ventilation techniques for facilitating the recovery of fish that are exhausted from simulated angling stress,2017,Fisheries Research,5,10.1016/j.fishres.2016.04.017,Fisheries Research,Hybrid
New and improved infra-red absorption cross sections and ACE-FTS retrievals of carbon tetrachloride (CCl4),2017,Journal of Quantitative Spectroscopy and Radiative Transfer,5,10.1016/j.jqsrt.2016.04.025,Journal of Quantitative Spectroscopy and Radiative Transfer,Hybrid
The effect of standing interventions on acute low-back postures and muscle activation patterns,2017,Applied Ergonomics,5,10.1016/j.apergo.2016.07.002,Applied Ergonomics,Hybrid
"Effects of multiple stresses hydropower, acid deposition and climate change on water chemistry and salmon populations in the River Otra, Norway",2017,Science of the Total Environment,5,10.1016/j.scitotenv.2016.09.044,Science of the Total Environment,Hybrid
Stochastic renewal process models for estimation of damage cost over the life-cycle of a structure,2017,Structural Safety,5,10.1016/j.strusafe.2017.03.002,Structural Safety,Hybrid
Using spectrotemporal indices to improve the fruit-tree crop classification accuracy,2017,ISPRS Journal of Photogrammetry and Remote Sensing,5,10.1016/j.isprsjprs.2017.03.019,ISPRS Journal of Photogrammetry and Remote Sensing,Hybrid
"Marine redox conditions during deposition of Late Ordovician and Early Silurian organic-rich mudrocks in the Siljan ring district, central Sweden",2017,Chemical Geology,5,10.1016/j.chemgeo.2017.03.015,Chemical Geology,Hybrid
Consensus seeking in multi-agent systems via hybrid protocols with impulse delays,2017,Nonlinear Analysis: Hybrid Systems,5,10.1016/j.nahs.2017.03.002,Nonlinear Analysis: Hybrid Systems,Hybrid
Solute pools in Nikanotee Fen watershed in the Athabasca oil sands region,2017,Environmental Pollution,5,10.1016/j.envpol.2017.03.038,Environmental Pollution,Hybrid
Are older drivers’ on-road driving error rates related to functional performance and/or self-reported driving experiences?,2017,Accident Analysis and Prevention,5,10.1016/j.aap.2017.03.006,Accident Analysis and Prevention,Hybrid
Modelling weather effects for impact analysis of residential time-of-use electricity pricing,2017,Energy Policy,5,10.1016/j.enpol.2017.03.015,Energy Policy,Hybrid
Shear confusion: Identification of the appropriate equivalent strain in simple shear using the logarithmic strain measure,2017,International Journal of Mechanical Sciences,5,10.1016/j.ijmecsci.2017.10.005,International Journal of Mechanical Sciences,Hybrid
"Keyframe-based monocular SLAM: design, survey, and future directions",2017,Robotics and Autonomous Systems,5,10.1016/j.robot.2017.09.010,Robotics and Autonomous Systems,Hybrid
Thermal management of a Sabatier reactor for CO2conversion into CH4: Simulation-based analysis,2017,Journal of CO2 Utilization,5,10.1016/j.jcou.2017.07.015,Journal of CO2 Utilization,Hybrid
The effect of type of afferent feedback timed with motor imagery on the induction of cortical plasticity,2017,Brain Research,5,10.1016/j.brainres.2017.08.025,Brain Research,Hybrid
"Carbon footprint of dietary patterns in Ontario, Canada: A case study based on actual food consumption",2017,Journal of Cleaner Production,5,10.1016/j.jclepro.2017.06.025,Journal of Cleaner Production,Hybrid
"Methane emissions dynamics from a constructed fen and reference sites in the Athabasca Oil Sands Region, Alberta",2017,Science of the Total Environment,5,10.1016/j.scitotenv.2017.01.076,Science of the Total Environment,Hybrid
Head-Mounted Display Technology for Low-Vision Rehabilitation and Vision Enhancement,2017,American Journal of Ophthalmology,5,10.1016/j.ajo.2016.12.021,American Journal of Ophthalmology,Hybrid
Evaluating zinc isotope fractionation under sulfate reducing conditions using a flow-through cell and in situ XAS analysis,2017,Geochimica et Cosmochimica Acta,5,10.1016/j.gca.2016.12.034,Geochimica et Cosmochimica Acta,Hybrid
Polyyne formation by ns and fs laser induced breakdown in hydrocarbon gas flow,2017,Carbon,5,10.1016/j.carbon.2017.01.003,Carbon,Hybrid
A multi-scale and multi-dimensional framework for enhancing the resilience of urban form to climate change,2017,Urban Climate,5,10.1016/j.uclim.2016.12.004,Urban Climate,Hybrid
Nitrate reduction and its effects on trichloroethylene degradation by granular iron,2017,Water Research,5,10.1016/j.watres.2017.01.031,Water Research,Hybrid
Cleaning high-frequency velocity profile data with autoregressive moving average (ARMA) models,2017,Flow Measurement and Instrumentation,5,10.1016/j.flowmeasinst.2016.12.005,Flow Measurement and Instrumentation,Hybrid
Micro-differential evolution: Diversity enhancement and a comparative study,2017,Applied Soft Computing Journal,5,10.1016/j.asoc.2016.09.042,Applied Soft Computing Journal,Hybrid
"Synthesis of amorphous manganese borohydride in the (NaBH4–MnCl2) system, its hydrogen generation properties and crystalline transformation during solvent extraction",2017,Journal of Energy Chemistry,5,10.1016/j.jechem.2016.08.011,Journal of Energy Chemistry,Hybrid
Transnational collaboration for sustainability in higher education: Lessons from a systematic review,2017,Journal of Cleaner Production,5,10.1016/j.jclepro.2017.07.256,Journal of Cleaner Production,Hybrid
"Frequency and temperature dependent electrochemical characteristics of carbon-based electrodes made of commercialized activated carbon, graphene and single-walled carbon nanotube",2017,Carbon,4,10.1016/j.carbon.2016.10.017,Carbon,Hybrid
Optimal allocation for electric vehicle charging stations using Trip Success Ratio,2017,International Journal of Electrical Power and Energy Systems,4,10.1016/j.ijepes.2017.03.009,International Journal of Electrical Power and Energy Systems,Hybrid
